{
	"id": "DragonLordsCrown",
	"name": "Couronne du roi-dragon",
	"description": "Infusé par les esprits et sculpté dans la roche, il est né au cœur de la montagne pour montrer la force de la terre face aux étendues de monolithes, et ses longues cornes dorées sont la marque de sa lutte contre un roi du passé.Cette corne avait, pendant un temps, été brisée et avait perdu de son éclat, mais désormais, elle brille d'une lueur froide et dorée, pendant que vous la tenez dans la paume de votre main.",
	"source": ["Défi d'Azhdaha (Niv.70+)"],
	"rarity": 5,
	"convert": [
		[
			{
				"id": "BloodjadeBranch",
				"name": "Branche de jade cramoisi",
				"amount": 1
			},
			{
				"id": "DreamSolvent",
				"name": "Solvant de rêve",
				"amount": 1
			}
		],
		[
			{
				"id": "GildedScale",
				"name": "Écaille dorée",
				"amount": 1
			},
			{
				"id": "DreamSolvent",
				"name": "Solvant de rêve",
				"amount": 1
			}
		]
	]
}
