{
  "id": "VayudaTurquoiseChunk",
  "name": "Morceau de turquoise vayuda",
  "description": "« Le vent change toujours de direction. »<br/>« Un jour, il soufflera vers un meilleur avenir. »",
  "source": [
    "Butin d'Hypostase Anémo (Niv.60+)",
    "Butin de Wenut de Setekh (Niv.60+)",
    "Synthèse"
  ],
  "rarity": 4,
  "craft": {
    "cost": 900,
    "items": [
      {
        
        "id": "VayudaTurquoiseFragment",
        "name": "Fragment de turquoise vayuda",
        "amount": 3
      }
    ]
  },
  "convert": [
    [
      {
        
        "id": "AgnidusAgateChunk",
        "name": "Morceau d'agate agnidus",
        "amount": 1
      },
      {
        
        "id": "DustOfAzoth",
        "name": "Poudre d'Azoth",
        "amount": 9
      }
    ],
    [
      {
        
        "id": "VarunadaLazuriteChunk",
        "name": "Morceau de lazurite varunada",
        "amount": 1
      },
      {
        
        "id": "DustOfAzoth",
        "name": "Poudre d'Azoth",
        "amount": 9
      }
    ],
    [
      {
        
        "id": "NagadusEmeraldChunk",
        "name": "Morceau d'émeraude nagadus",
        "amount": 1
      },
      {
        
        "id": "DustOfAzoth",
        "name": "Poudre d'Azoth",
        "amount": 9
      }
    ],
    [
      {
        
        "id": "VajradaAmethystChunk",
        "name": "Morceau d'améthyste vajrada",
        "amount": 1
      },
      {
        
        "id": "DustOfAzoth",
        "name": "Poudre d'Azoth",
        "amount": 9
      }
    ],
    [
      {
        
        "id": "ShivadaJadeChunk",
        "name": "Morceau de jade shivada",
        "amount": 1
      },
      {
        
        "id": "DustOfAzoth",
        "name": "Poudre d'Azoth",
        "amount": 9
      }
    ],
    [
      {
        
        "id": "PrithivaTopazChunk",
        "name": "Morceau de topaze prithiva",
        "amount": 1
      },
      {
        
        "id": "DustOfAzoth",
        "name": "Poudre d'Azoth",
        "amount": 9
      }
    ]
  ]
}